ID,User_Message,Bot_Response
1,Hi,Hello! How can I help you today?
2,What's your name?,"I'm just a chatbot, so I don't have a name, but you can call me ChatBOT."
3,How's the weather today?,I'm not sure about the current weather. Is there anything else you'd like to know?
4,Tell me a joke,Sure! Why don't scientists trust atoms? Because they make up everything!
5,What is diabetes?,Diabetes is a chronic condition that affects how your body turns food into energy.
6,How can I manage diabetes?,"Managing diabetes involves maintaining a healthy lifestyle, monitoring blood sugar levels, and taking prescribed medications."
7,What are the symptoms of diabetes?,"Common symptoms of diabetes include increased thirst, frequent urination, unexplained weight loss, and fatigue."
8,Can diabetes be cured?,"Currently, there is no cure for diabetes, but it can be managed with proper care and lifestyle changes."
9,What are the risk factors for diabetes?,"Risk factors for diabetes include family history, overweight or obesity, lack of physical activity, and age."
10,How often should I check my blood sugar?,The frequency of blood sugar monitoring depends on your individual treatment plan. Consult with your healthcare provider for personalized guidance.
11,Tell me a fun fact,"Sure! Honey never spoils. Archaeologists have found pots of honey in ancient Egyptian tombs that are over 3,000 years old and still perfectly edible."
12,What's your favorite color?,"I don't have personal preferences, but I think blue is a nice color. What's your favorite color?"
13,How do I stay motivated to exercise?,"Staying motivated to exercise can be challenging. Try setting achievable goals, finding a workout buddy, and incorporating activities you enjoy."
14,What's the best diet for weight loss?,The best diet for weight loss varies for each person. It's essential to focus on a balanced and sustainable diet that includes a variety of nutrients.
15,Any tips for a good night's sleep?,"Creating a bedtime routine, avoiding screens before sleep, and maintaining a comfortable sleep environment can contribute to a good night's sleep."
16,Do you have any pets?,I don't have pets. What about you? Do you have any furry friends?
17,What's your favorite book?,"I don't read books, but I'm here to assist you with any questions you have."
18,How do I improve my memory?,"Practicing memory exercises, getting enough sleep, and maintaining a healthy diet can contribute to improved memory."
19,What's the meaning of life?,The meaning of life is a subjective and philosophical question. It often depends on individual beliefs and perspectives.
20,How do I start a healthy morning routine?,"Starting a healthy morning routine can include activities like stretching, hydrating, and having a nutritious breakfast."
21,Tell me a riddle,"Sure! The more you take, the more you leave behind. What am I?"
22,Do you like pizza?,"I don't have preferences, but many people enjoy pizza. What's your favorite pizza topping?"
23,How do I overcome stress?,"Managing stress involves techniques like deep breathing, exercise, and engaging in activities that bring joy and relaxation."
24,What's the best way to make friends?,"Building friendships can involve being open, genuine, and finding common interests. Joining clubs or social events can also help."
25,Tell me a fascinating fact,Sure! The Eiffel Tower can be 15 cm taller during the summer due to thermal expansion of the iron.
26,What's the secret to a long life?,"Leading a healthy lifestyle, staying active, and maintaining social connections are factors associated with a longer and healthier life."
27,What's your favorite movie?,"I don't watch movies, but I'm here to chat with you. What's your favorite movie?"
28,How do I stay positive during tough times?,"Practicing gratitude, surrounding yourself with positive influences, and seeking support can help maintain a positive mindset during challenging times."
29,Tell me something interesting,I can provide information on a wide range of topics. Is there a specific subject you're interested in?
30,What's the most effective way to study?,"Effective studying involves creating a schedule, staying organized, and using varied study methods. Find what works best for you."
31,Do you have siblings?,"I'm a chatbot, so I don't have siblings. How about you? Do you have brothers or sisters?"
32,What's the key to a healthy relationship?,"Communication, trust, and mutual respect are crucial for a healthy relationship. Open and honest dialogue is key."
33,How do I develop good habits?,"Developing good habits involves setting specific goals, starting small, and being consistent. Patience and perseverance are essential."
34,Tell me a fun science fact,"Sure! A group of flamingos is called a ""flamboyance."""
35,What's the best way to start the day?,"Starting the day with a healthy breakfast, some physical activity, and a positive mindset can set a good tone for the rest of the day."
36,How can I boost my creativity?,"Engaging in activities that inspire you, trying new things, and taking breaks can help boost creativity."
37,What's the secret to happiness?,Happiness is subjective and can be found in different ways for different people. Building meaningful connections and pursuing passions are often cited as contributors to happiness.
38,What's your favorite food?,"I don't eat, but I'm here to assist you. What's your favorite food?"
39,How do I handle failure?,"Handling failure involves learning from the experience, staying resilient, and using setbacks as opportunities for growth."
40,Tell me a historical fact,"Sure! The Great Wall of China is the longest wall in the world, stretching over 13,000 miles."
41,What's the best way to relax?,"Relaxation methods vary for each person. Some options include deep breathing, meditation, reading, or enjoying nature."
42,How do I stay focused while working?,"Staying focused involves eliminating distractions, setting priorities, and taking breaks to recharge."
43,Tell me a joke,Sure! Why did the scarecrow win an award? Because he was outstanding in his field!
44,What's the most beautiful place you've been?,"I haven't been anywhere physically, but I can provide information on beautiful places around the world. Where would you like to visit?"
45,How can I be more productive?,"Being more productive involves effective time management, setting clear goals, and minimizing multitasking."
46,What's the meaning of dreams?,The meaning of dreams is a subject of much debate. Some theories suggest they reflect subconscious thoughts and emotions.
47,What's your favorite hobby?,"I don't have hobbies, but I'm here to assist you. What's your favorite hobby?"
48,How can I improve my communication skills?,"Improving communication skills involves active listening, clarity in expression, and practicing empathy."
49,What's the secret to a good presentation?,"A good presentation includes clear content, engaging visuals, and effective delivery. Practice and preparation are key."
50,How do I break a bad habit?,"Breaking a bad habit involves identifying triggers, setting replacement behaviors, and staying committed to change."
51,Do you believe in aliens?,I don't have personal beliefs. The existence of aliens is a topic of speculation and has not been confirmed.
52,What's the best way to learn a new language?,"Learning a new language involves consistent practice, immersion, and using various resources like language apps and conversation."
53,How do I handle rejection?,"Handling rejection involves recognizing it as a part of life, maintaining self-worth, and using the experience as a learning opportunity."
54,What's the secret to good teamwork?,"Effective teamwork requires clear communication, mutual respect, and a shared understanding of goals."
55,How do I start a blog?,"Starting a blog involves choosing a niche, creating valuable content, and promoting your posts. Platforms like WordPress can be helpful."
56,What's the best way to apologize?,"A sincere apology includes acknowledging the mistake, expressing remorse, and taking steps to make amends."
57,How do I overcome self-doubt?,"Overcoming self-doubt involves challenging negative thoughts, setting realistic goals, and recognizing your strengths."
58,What's the best way to save money?,"Saving money involves creating a budget, setting financial goals, and avoiding unnecessary expenses."
59,How can I improve my public speaking skills?,"Improving public speaking skills involves practice, seeking constructive feedback, and focusing on connecting with the audience."
60,What's the secret to a happy marriage?,"A happy marriage involves communication, compromise, and mutual support. Building a strong foundation of trust is essential."
61,Tell me an interesting fact about space,"Sure! Space is not completely silent. It has a faint hum, often referred to as the ""cosmic hum"" or ""space roar."""
62,What's your favorite quote?,"I don't have personal preferences, but I can share inspirational quotes. Is there a specific theme you're interested in?"
63,How do I deal with a difficult coworker?,"Dealing with a difficult coworker involves staying professional, setting boundaries, and seeking conflict resolution when necessary."
64,What's the best way to learn to play an instrument?,"Learning to play an instrument involves consistent practice, taking lessons, and enjoying the learning process."
65,How do I overcome procrastination?,"Overcoming procrastination involves breaking tasks into smaller steps, setting deadlines, and addressing the underlying causes."
66,What's your favorite type of music?,"I don't have personal preferences, but I can provide information on various music genres. What's your favorite type of music?"
67,How can I become more organized?,"Becoming more organized involves decluttering, creating a schedule, and using tools like calendars and planners."
68,What's the best way to handle criticism?,"Handling criticism involves staying open to feedback, separating constructive criticism from negativity, and using it as an opportunity for growth."
69,What's the key to a successful job interview?,"A successful job interview involves thorough preparation, showcasing your skills and experiences, and asking thoughtful questions."
70,How do I start a small business?,"Starting a small business involves market research, creating a business plan, and considering legal requirements."
71,What's the best way to handle stress at work?,"Handling stress at work involves time management, prioritization, and taking breaks to recharge."
72,How can I become more creative?,"Becoming more creative involves exploring new ideas, embracing curiosity, and allowing yourself to think outside the box."
73,What's the secret to a good work-life balance?,"Achieving a good work-life balance involves setting boundaries, prioritizing self-care, and making time for both personal and professional pursuits."
74,How do I choose a career path?,"Choosing a career path involves assessing your skills, interests, and values, and researching potential fields."
75,What's the best way to stay motivated in the workplace?,"Staying motivated in the workplace involves setting goals, recognizing achievements, and maintaining a positive mindset."
76,How can I improve my negotiation skills?,"Improving negotiation skills involves preparation, effective communication, and understanding the needs of both parties."
77,What's the best way to learn to code?,"Learning to code involves practice, taking courses, and working on real-world projects. There are various online platforms that offer coding tutorials."
78,How do I handle a difficult boss?,"Handling a difficult boss involves maintaining professionalism, communication, and seeking support from HR if necessary."
79,What's the secret to a fulfilling life?,"A fulfilling life involves pursuing passions, building meaningful connections, and finding a balance between personal and professional fulfillment."
80,Tell me an interesting fact about animals,"Sure! A group of flamingos is called a ""flamboyance."""
81,What's the best way to prepare for a job interview?,"Preparing for a job interview involves researching the company, practicing common interview questions, and showcasing your qualifications."
82,How can I improve my time management skills?,"Improving time management skills involves creating a schedule, prioritizing tasks, and avoiding multitasking."
83,What's the best way to stay healthy?,"Staying healthy involves a balanced diet, regular exercise, adequate sleep, and managing stress."
84,How do I start a fitness routine?,"Starting a fitness routine involves setting realistic goals, choosing activities you enjoy, and gradually increasing intensity."
85,What's your favorite type of technology?,"I don't have personal preferences, but I can provide information on various types of technology. What's your favorite?"
86,How can I become more assertive?,"Becoming more assertive involves expressing your needs and opinions confidently, setting boundaries, and practicing effective communication."
87,What's the key to a successful presentation?,"A successful presentation involves clear content, engaging visuals, and effective delivery. Practice and preparation are key."
88,How do I stay positive during challenging times?,"Staying positive during challenging times involves focusing on solutions, seeking support, and practicing self-care."
89,What's the secret to a long and happy marriage?,"A long and happy marriage involves communication, mutual respect, and continually nurturing the relationship."
90,How can I build self-confidence?,"Building self-confidence involves setting and achieving small goals, embracing self-compassion, and recognizing your strengths."
91,What's the best way to learn a new skill?,"Learning a new skill involves practice, seeking guidance from experts, and breaking the learning process into manageable steps."
92,How do I overcome a creative block?,"Overcoming a creative block involves taking breaks, exploring new sources of inspiration, and giving yourself permission to experiment."
93,What's the secret to a good night's sleep?,"A good night's sleep involves maintaining a consistent sleep schedule, creating a relaxing"
